sabe pq bolsonaro cia apareceu pra dar nenhuma palavra sobre morte agatha pq forjar pouco velha falariam que marmita traficantese menino negro estaria circulando fotos falsas segurando arma,0
horário verão estaria prestes começar então deixo aqui vai tomar cu todos votaram atual presidente seus bosta,0
recepção bolsonaro nova york agora pouco amazonia sim bolsonaro não,0
repito urgente eleitores presidente bolsonaro organizem militância usem contra esquerda ladra assassina narcotraficanteos recursos agressivos lei permita,1
presidente interir na morte ágatha culpa narco tráficoagora notícias brasil,0
presidente bolsonaro sucesso abertura assembleia geral onu país dignamente representado,1
esquina rua hotel onde presidente brasil hospedado em nova york petistas gritam palavras ordem contra bolsonaro tradicional lula livre,0
crente bolsominion deus libre,0
bolsominion acabou responder dizendo quer polícia deixe fazer operações pra preservar vida moradores favelas puts claro quero,0
atenção brasil pautou pressas amanhã sessão derrubar vetos bolsonaro lei abuso autoridadepra picaretagens sempre arrumam tempo de,1
agatha vítima bolsonaro witzel aconteceu ágatha félix resultado política ódio witzel bolsonaro assista entenda,0
recepção calorosa bolsonaro nova york amazônia sim bolsonaro não,1
mourão revela todo esquema quadrilha trás tragédia sofrida aghata morro alemão via youtube bolsonaro news,1
manifestantes marcharam nesta segunda-feira 23 protesto contra presença presidente bolsonaro abertura cúpula onu nova iorque organizada movimento rise and resista marcha reuniu cerca 4 mil pessoas diversas organizações,0
bingo discurso bolsonaro onu comunistas talkei maduro macron soberania venezuela pt lula negação queimadas globalismo merkel patriotismo valores cristãos defesa família donald trump ideologia gênero,0
bolsonaro olha bozo passando vergonha gringa,0
presidente senado davi alcolumbre convocou pressas terça feira sessão congresso analisar vetos presidenciais pauta 36 vetos presidente bolsonaro lei abuso autoridade,0
pensaram bolsonaro amante cartão corporativo liberado saqueado petrobrás perdido milhões sucata pasadena usado 500 bilhões dinheiro corrupção via bndes petista moral pra falar nada paloccifaloumidiacalou,0
bolsonaro tocar mundo inteiro contra elepor anti globalista seja esse governo sobrevive apenas protetora do estados unidos mais especificamente donald trump que sinal anda reticente relação colega pobre submisso,0
governo bolsonaro autorizou repasse finalização trecho canal sertão alagoano logo estará totalmente concluído empreendimento irá beneficiar milhão pessoas via,1
mídia deu destaque protestos contra bolsonaro nova york namorado fátima bernardes meia duzia vagabundos,1
índia ysani general heleno primeira dama michelle bolsonaro chegando hotel nova yorkchupa cacique raoni,1
bolsonaro encurtou agenda nova york porque ninguém quer reunir-se hojeuma foto lado presidente ataca meio ambiente pega mal qualquer autoridade país civilizado,0
bigbang influente presidente amo pq dizem flops hein,0
enterro menina que assassinada polícia aí oq policial oportunista faz vai lá farda querendo conversar que ter tomado paucusão crl queria promover típico bolsominion,0
gente ficam revoltados pq presidente tirou simples horário verão aconteceram coisas mt piores tempos passados agora sabem falar disso,1
vamos enfrentá-los exército 70 milhões eleitores presidente fazemos queda brasíliaou elites políticas imundas vão matar famílias vamos mudar brasil vejam,1
ok fodase admito guedes verdadeiro presidente,0
bolão assessores pt câmara campeão mega-sena acumulada caixa sob bolsonaro desembolsar cheque r 129 milhões 49 petistas brasil 2019 escrito sala roteiristas,1
lideranças indígenas brasil celebram presença ysani kalapalo comitiva bolsonaro onu,1
bolsonaro vai gastar 40 milhões cofres públicos propaganda melhorar imagem brasil exterior governo patético enquanto coloca fogo amazônia saúda ditadoresacredita pode tapear mundo fake news paga dinheiro população,0
fique dentro todos detalhes discurso presidente abertura assembleia geral onuem nova iorque fala presidente transmitida vivo facebook nesta terça 24 10h perca,1
nada deixa nacionalistas assanhados servir nacionalistas americanos,0
vejam coincidências 1 demori lambe-saco lula blogueiro interceptme acusa algo absurdo quer provar tese fico zuando pt pq pago bolsonaro 2 cel hackeado 4 chefe fala hacker lava-jato sobre hackemanto,1
silêncio presidente república ministro justiça governador diante assassinato brutal criança 8 anos covardia ensurdecedora dá medida exata caráter desse trio,0
robôs bolsonaro levantaram tag gregorio duvivier tirar atenção roda viva flávio dino governador maranhão eleito pcdob partido comunista brasil extrema-direita briga acirrada contra comunistas petistas,0
gosto fale assim presidente,1
chegou esculachado bolsonaro alvo críticas vaias protestos chegada nova york presidente chegou hoje 74° assembleia geral onu recebido grupos pró meio ambiente gritos amazônia sim bolsonaro não,0
nove meses presidente priorizou agenda eventos militares evangélicos,0
quero ver esquerdopatas falar indígenas propriedade ysani kalapalo viajará bolsonaro assembleia geral onu,1
1195 dias fim governo bolsonaro,0
vamos lá segundo esquerda onu sou bancado eduardo bolsonaro rei vaporwaves além ser pavão misterioso resumo pessoasou idéia nãoa certa muma,1
estudo comprova 95 seguidores bolsonaro reais prestes atingir 33 milhões seguidores redes sociais sendo chefe estado popularidade mundo fato histórico querem minardizendo robôs,1
vamos aumentar seguidores sim então bora seguir passos apoiamos presidente,1
flávio dino roda viva dizendo jair bolsonaro nunca pró-lava-jato bolsonaro poucas vozes parlamento denunciando projeto criminoso poder daqui pouco roda viva convidará nicolás maduro kim-jong-un opinar sobre democracia,1
flávio decepção decepção sen flávio bolsonaro psl/rj queremos veto abuso autoridade vetatudo,1
amanhã assembleia geral bolsonaro trump sisi erdogan buhari al-thani moon jae-in macron pi macri andrzej duda conte abe pedro sanchez jacinda ardern boris johnson ser feriado pra todo mundo poder assistir,1
vamos pedir impeachment rodrigo maia davi alcolumbre stf tiramos corruptos acabam presidente país,1
alcolumbre postergou novamente votação previdência convocou sessão conjunta congresso pode derrubar vetos sobre abuso autoridade pauta votada pressas câmara jogada pro bolsonaro resolver treta igual fundão deixem brasil respirar,0
empreendedor visão estaria montando assessoria reconstrução imagem pública quantidade energúmenos oportunistas lambendo botas bolsonarismo vai pagar rios dinheiro serviço quando bolsonaro cúmplices cadeia,0
new york timesmaior jornal mundoquer bolsonaro condenado crimes contra humanidade,0
peço ajudem divulgar acolumbre traidor da patria,0
pt tão corrupto frauda eleição propria presidente partido,0
ansiosa ver discurso presidente logo maisàs 10h brasília lá onu eua certeza vai dar recado bem dado deus abençoe brasileiros fé,1
comandante presidente bolsonaro,1
atrevem frase indignada greta thunberg governantes mundo sobre destruição planeta repito senhor atreve bolsonaro chegou onu cinismo responsável queimar amazônia,0
governador pedetista amapáao abalar nova york convite macron discutir amazôniaparece desconhecer constituição brasileira compete privativamente presidente república manter relações estados estrangeiros insulto nação,1
perto carlos bolsonaro dilma winston churchill,0
dois erros crassos governo bolsonaro apoiar maiao botafogoe alcolumbreo batoré,1
operações policiais midáticas favela têm ser encaradas campanha witzel 2022 andamento cara tá usando dinheiro público sangue favelado policial pra tentar eleger presidente política pura,0
bolsonaro brilha nova york,1
luta contra fascismo exige pq bolsonaro cairá maduromas pq fascismo além bolsonaro precisamos urgentemente maiores profundos debates sobre fascismo combate ele,0
imagine triste ser esquerda descobrir empresa trabalha doou 40 mil reais atual presidente campanha eleitoral dele,1
pessoal esclarecendo amiga área vip frente hotelfechada imprensase falarem vieram brasileiros recepcionar bolsonaro mentira aberto público,0
greta devia organizar manifestação manaus chamar atenção destruição ambiental amazônia atingiu níveis catastróficos governo fascista bolsonaro,0
tô medo trás disso tudo flávio bolsonaro,0
cantando pedra chamado inimigo senado sabe quer presidente aumente impostos pedalar pedalar impeachment sabichões vocês sabem,1
bofe presidente macrontoda frança critica macron sair armarioo casamento fachada senhora idosa irrita franceses,1
parabéns bolsonaro bolsonaro razao,1
saudade época antes bolsonaro ser eleito havia homofobia racismo rj suíça brasileira um lugar calmo tranquilo traficantes bala perdida morte inocentes quase ouvia falar educação melhores mundo volta pt,1
impressionante frase bolsonaristas possa ser usada contra mesmos qualquer assunto caixão palanque aparelhamento corrupção nepotismo bandidagem ausência critério técnico viés ideológico analfabetismo funcional presidente etc,0
menos 24 horas discurso jair bolsonaro onu vem chacota internacional,0
trump chega onu diz bolsonaro bom homem,1
queria ver bolsonaro abrisse sorriso lindo pra elaela ia derreter vão deixar chegar perto dele,0
bolsonaro quer polícia mate bandido morocom pacote anti-crime apresentou excludente ilicitudeque licença matar política segurança pública demagógica covarde pode agradar apoiadores linchamento mas morre agatha,0
brasil país piada pronta,0
presidente sucesso palloci falou midia calou,1
gentea comitiva presidente muito maior trouxa deve ser frustrante pra eles,1
luta block carlos bolsonaro xingamentos bolsominions,0
pária global bolsonaro evitado trump hotel barclay,1
falou viva bolsonaro biografia,0
nova york bolsonaro amarga protestos hotel ignorado pro trump,0
projeção nova york denunciar bolsonaro política fascista devasta amazônia cancela bolsonaro freelula lulalivre,0
bolsominion acha aborto assassinatomas defende policia fuzilar costas criança 8 anos acidente,0
toda razão papel bolsonaro relação estados unidos coisa humilhante soberania palavra governo desconhece confira entrevista lula concedeu ao,0
líder bancada bala diz estar longe ser devoto bolsonaro,0
decisão pegou governo jair bolsonaro surpresao presidente senado davi alcolumbre dem-ap adiou início primeiro turno votação reforma previdência,0
congresso prepara derrubar vetos bolsonaro lei abuso autoridadetambém conhecida lei pró-crime sessão marcada amanhã ajuntamento bandidos freios,1
bolsonaro usando descendente indígena youtuber dizer representa índios brasil concorda políticas precisamos subir tag ysani mente peço ajuda todosvamos colocar tag primeiro lugaresquerda unida,0
bolsonaro liturgia cargo bolsonaro provocativo falta bolsonaro bons modos a liturgia cargo palavra min paulo guedes,0
silvio santos começou andar bolsonaro tá radiação,0
candidato embaixador eua xingou presidente frança idiota agora resolveu chamar bacheletex-presidente chile atual comissária onude ladra dudu hambúrguer quer transformar diplomacia brasileira baixaria vergonha internacional,0
protesto contra bolsonaro nova iorque,0
cana neles operação pf mira fraudes sistema previdenciário absurdo prejuízo r 55 milhões poucos governo bolsonaro vai descobrindo tudo esquerdalha estragouroubou escondeu,1
ei mulheres vejam contra bolsonaro eiii mulheres olhem,1
sorte chico hein impressão digital bozo daria baita desvalorização prêmio,0
então vamo transa mandato bolsonaro acaba,0
deputada erika kokay genebrana suiçaencher saco onu sobre governo bolsonaro fazer fofoca sobre direitos humanos amazônia perguntas hospedou-se alberque hotel luxo classe econômica primeira classe bancou palhaçada,1
namorado fátima bernardes ex bonner foi pra nova york dinheiro público pra fazer farra protesto deveria estar trabalhando congresso pra votou namorado ex bonner ele enganou babaca bolsonaro imbativel,1
lideranças xingu repudiam representação indígena delegação bolsonaro onu brasil 247,0
maior potência mundo bolsonaro,1
boa noite presidente lula primavera poderosos puderam impedir chegada assim poderão impedir vitória que deus preparou pra aguarde pouco confie pouco coisas boas ainda pra acontecer assim que creio,0
bolsonaro vive universo paralelo comparar presidente república traidores patria saia matrix querida,0
bolsonaro escove dentes,0
doençaela vazia alma aí pode então incitar morte presidente república família,1
tv brasil vai transmitir vivoa partir 10h amanhãterça24/09/ discurso excelentíssimo senhor presidente república federativa brasil jair messias bolsonaro abertura anual assembleia geral nações unidas,1
amanhã volta 10:30h hora brasília presidente jair bolsonaro abrirá assembleia geral onu levando mensagem brasileiros mundo sobre brasil deixarei disponibilizado link transmissão vivo redes peço possível compartilhar link,1
olha aquiameaça morte presidente assim cara dura pode,1
desgraçado contra br 319 vida toda vai sair causa governo bolsonaro,1
ta sendo investigada receber propina oas durante governo pt preciso dizer nd,1
tão falso quanto nota 3 reais bolsonaro usou colar indígena sair hotel hospedado jantar nova york adereço presente índia ysani kalapalo acompanha viu filmadoabraçou índia folha, 0
india bolsonaro mente igual mds gente quanto baixo nível ysani menteies,0
simessa primeiro último vazamento fato existem vários relatos desmanche petrobras galope pra acha que exagero falar desmanche que culpar governo precipitadodeixo palavra presidente petrobras,1
outro desgraçadonão muda quase nada bosta presidente,0
motora uber chatiadissimo disse votei bolsonaro pra dar lição pt vida so piorou desde cara assumiu pois é,0
arrasadora deputada federal samia bonfim sapateia cara ministro sérgio moro dizna cara tudo queremos dizer conseguimos chama ministro enrolãomentirosocovarde conivente milicianos gabinetes família bolsonaro lavar alma,0
sensata presidente brasil,0
direita histérica paladinos contra pedofilia se cala frente clara sexualização infantil rede nacionalno programa amigo presidente mamadeira pirocané,0
hotel bolsonaro nova york alvo projeções protesto lula livre recepção dessa auto estima bolsonaro nunca altadeve rente chão,0
prisão presidente lula maiores injustiças história lulalivre,0
pecado ser filho bolsonaro pecado msm,0
falta lobão gritar lula livregolpifora bolsonaro moro corrupto,0
raiva bolsonaro ansiedade reais,0
presidente que bom deus proteja sempre queremos qualidade vidapoder compra brasil fato justo todos contamos senhor toda equipe boa noite brasil bolsonaro presidente deus,1
recepção bolsonaro nova york começo hein bolsonaro nao amazonia sim,0
vezes pego sonhando lula lindo presidente,0
sensacional ação agora noite nova york projeção denunciar ameaça bolsonaro representa pedir lulalivre parabéns comitê defend democracy in brazil sigam fio fotos cancela bolsonaro,0
vamos mostrar apoio guerreira líndia comitiva presidente onu rt brasil com ysani,1
conteúdo forma preocupa alguns diplomatas bolsonaro lê criança recém-alfabetizada,0
polícia vai matar gente rua igual baratapromete bolsonaro – correio brasil,0
ninguém lustrou tanto botas ditador sanguinário fidel castro quanto lula,1
lula livre ripa bolsonaro,0
desejarem assistir discurso bolsonao amanhã 74a assembleia geral onuo presidente iniciará palavras volta onze horas manhãhorário brasília ajude divulgarpois imprensa fará tudo distorcer fala bolsonaro,1
orlando curicica traz informação perturbadora pode demonstrar ligação execução marielle família bolsonaro podemos estar sendo governados milícia policial antifascismo comenta,0
definitivamente gosto manuela pôs disposição justiça entregou telefone perícia filho mito diria que manu honesta bolas que membro clã bolsonaro heróis merda que escolherem perdem esquedistas,0
bolsominion coisa assim burra né puta que pariu tão usando imagens pais greta selos antifascista algo ruim,0
atores globo agora querem repudiar indicação jovem indígena ysani kalapalo escolhida compor delegação brasileira onu advinhemeles queriam bolsonaro levasse sônia guajajara suposta índia psol perderam juízo,1
senhora bachelet atacar bolsonaro delatada leo pinheiro oas,1
caciques 14 povos xingu protestam contra indígena convidada bolsonaro ir onu,0
perfil aglutinador clareza rumos traços exibidos flavio dino entrevista roda viva reúne condições liderar forças centro democrático esquerda elaboração programa reconstrução retomada desenvolvimento pós-bolsonaro,0
ídolo minions segue passando vexames mundo roda viva,0
lembrando presidente lamentou morte mc reaça,0
lembram bolsonaro sempre diz comprando amazônia então dividirei vídeo partes, 0
ainda dá tempo todo mundo agir horário verão,0
tremenda falta respeito presidente falta espírito patriótico adorei,0
professor elogiar bolsonaro quase todos alunos retiraram sala achei ser curso pagoa maioria coxinha bolsominionporém não,0
enquanto trabalha pagar salário lá participando manifestaçãozinha contra presidente,1
recebi primeiro vídeo ciro gomes via whats app eleitor bolsonaro arrependido começo ter esperança,0
guedes prova viva importa falamas sim fala diz bolsonaro playboizada presidente diz valor pq povão baba ovo rico agora rico povão,0
filósofos sociólogos psicólogos imenso trabalho desvendar comportamento histórico absurdo esse,0
cancel bolsonaro jair bolsonaro chegou hotel intercontinental barclayem nova yorkonde hospedados outros chefes estado recebido ambientalistas manifestantes denunciando porta localos retrocessos ambientais promovidos governo brasileiro,0
resumo governador precisa culpar usuários apenas isentar-se culpa autoevidente sobretudo isentar eleitor mentalidade depende eleger presidente brasil,0
bolsonaro gosta fingir palhaço zueiromas aqui tá recado turma fundão pra novo ep gregnews,0
carro pra quêse podem ir pé ysani kalapalo alto xingu general heleno michelle bolsonaro economizam andam pé nova york brasil com ysani,1
momento antagonista vaza jatoglenn falo desdobramento inquérito hackers bolsonaro onuescorregada guedes vetos abuso autoridade,1
reclama mav bolsonaro agoradiga iguais petistas,1
boa noite sr presidente,1
sinto ruim governador presidente conseguiu despertar presidente menos ainda desconfiança burro ignoranteainda mal intencionado governador sociopata mesmo,0
acreditam cegamente família bolsonaro chefes milícia mantra tanto repetirse convenceram real lavagem cerebral feita sucesso dizem mente vazia oficina diabo,1
contamos senhor senador lutar justo correto quanto lei abuso autoridadeespero senhor vote contra derrubada vetos presidente,1
relação bolsonaro trump total subserviência faz bem brasil faz bem bolsonaro quer saber ninguém gosta respeitaninguém gosta lambe-botas ninguém gosta lambe-botas,0
dps querem dizer bolsonaro tá errado mim podia matar todos,1
sen flávio bolsonaro psl/rj queremos veto abuso autoridade vetatudo,1
colocou cabeça desse cara que pode ser presidente república,0
bem saudevai presidente arrebenta odestes comunistas sujos fedorentos descendentes gramsci,1
quero ver agora esquerdopatas mst invadirem propriedades rurais vejam recado abaixo bolsonaro, 1
acho que marília mendonça deveria ser presidente desse paísrainha,0
caciques denunciam bolsonaro levou liderança indígena fake nações unidas,0
primeira vez históriaum governante desconsidera óbvio coloca população risco morte,0
atenção presidente senado marcou amanhã 24/9 sessão congresso nacional pode derrubar manter vetos abuso autoridade 36 senadores declararam manterão vetos precisamos 5 senadores contatem senadores estado,0
paulo guedes retruca acusa bolsonaro ações autoritárias escancara pt corrompeu democracia,1
excelente entrevista roda viva jornalistas fizeram pegadinhas interromperam deram espaço p/brilhantismo governador quero que dino venha ser presidente,0
meia hora bolsonaro sai onu fazendo arminha,0
pra cima presidente boa sorte que deus dando sabedoria discernimento torcida,1
vamos viralizar discurso alternativo antes pronunciar direitos humanos meio ambiente indígenas marielle presente discurso brasil onu lido bolsonaro mafolly,0
bolsonaro leva internet 1 milhão alunos nordeste acontece agora online,1
espírito preparado argumentação afiada independente disser presidente abertura assembleia geral onua midiazinha vermelha vai tentar lacrar dia combate,1
governo bolsonaro faz diferença responsabilidade dinheiro público deus abençõe presidente redor fazendo pouco tempo governo avante brasil,1
bolsonaro quer lei torne voto impresso obrigatório brasil,1
moleque enche saco prof idoso assunto bolsonaro gravae joga aqui pra generalizar trabalho prof bunda sujarss tanto quanto mins nojento pres imundomas nada vai mudar trabalho crítico profnada podem esperniar,0
torpe exploração agatha morte menina 9 anos favela rio tragédia pessoal familiar consequência incompetência poder públicomas usá-la pretexto desgaste político bolsonaro moro witzel execrável vídeo youtube, 0
flávio dino governador incomoda bolsonaro entrevistado roda,0
teoria aquecimento global teoria leva sério desgraça dessas,1
vão conseguir senhor todo poderosoestá lado pessoas bem deste país presidente bolsonaro mal prevalecerá,1
hashtag cancela bolsonaro onu bombando nova york mundo vamos subir,0
chicana jurídicafruto cabeça gilmarlewane cármen lúciapermitiu 1ª anulação stf condenação proferida moro lava jato bendineex-presidente petrobras indicado dilma prevalecer32 sentenças lava jato podem ser anuladas,1
pense debate político flávio dinolula jair bolsonaro gargalhando aqui abismo conhecimentoexperiência preparo bolsonaro iria desmaiar certeza roda viva,0
lamentável 1ª pág folha despravada dedicada maduro ataque ditador presidente bolsonaro qualquer imprensa séria mundopela miséria que levou país povoesse elemento mereceria nota rodapé manteremos ajuda irmãos venezuelanos,1
censuraum efeito cascata corrói arte brasil bolsonaro,0
verificamos falso exército abriu 200 poços nordeste governo bolsonaro,0
enumerando alguns feitos governo bolsonaro últimos dias mais impostos zerados medicamentos câncer aids governo zera impostos centenas produtos equipamentos produção médicos exames cirurgias oftalmológicas informática,1
vamos ter ficar olho gato outro frigideira porque congresso deve aprontar alguma enquanto acompanhamos presidente fala onu,1
aposta contava nova política externa br jesus põe mão que medo vai ser vergonha ainda maior maior que vergonha que diplomacia fará passar durante convenção,0
deputado federal viaja brasil eua dinheiro público juntar 6 dúzia protestar contra presidente vergonha namorado fátima bernardes,1
gigi existe adjetivos agora hipócrita luciano huck aproveitando pra fazer palanque lulu passa merdinha colocou nessa cabeça único neurônio pode ser presidente doce lar ridículo,1
